{
  "id": "syn-claude-code-2.1.116-12-sec",
  "schema_version": "1",
  "input": {
    "product": "claude-code",
    "version": "2.1.116",
    "released_at": "2026-04-20",
    "kind_hint": "changed",
    "change_text": "Security: sandbox auto-allow no longer bypasses the dangerous-path safety check for `rm`/`rmdir` targeting `/`, `$HOME`, or other critical system directories",
    "source_url": "https://github.com/anthropics/claude-code/releases/tag/v2.1.116",
    "change_id": "claude-code/2.1.116/12"
  },
  "output": {
    "kind": "security",
    "severity": "high",
    "subject": "Sandbox auto-allow bypassed dangerous-path check for `rm` against /, $HOME",
    "action_text": "Upgrade to `claude-code` 2.1.116+ to re-enable the dangerous-path safety check for `rm`/`rmdir` against `/`, `$HOME`, and other critical system directories under sandbox auto-allow. Pre-fix, agents in auto-allow mode could destroy host directories via sandboxed bash.",
    "deadline": null,
    "tags": [
      "sandbox-bypass",
      "data-loss",
      "destructive-rm"
    ]
  },
  "provenance": {
    "labeler": "opus-4.7-this-session-a25",
    "labeled_at": "2026-05-24",
    "reviewer": "human+qwen3-judge-a3c",
    "reviewed_at": "2026-05-25",
    "review_action": "approved"
  },
  "quality": {
    "faithfulness": "ok",
    "schema_valid": true,
    "human_grade": null
  }
}
