{
  "id": "syn-windsurf-2026-05-16-bug-fixes-and-improvements-4",
  "schema_version": "1",
  "input": {
    "product": "windsurf",
    "version": "2026-05-16-bug-fixes-and-improvements",
    "released_at": "2026-05-16",
    "kind_hint": "changed",
    "change_text": "Repaired path resolution for the Devin local agent on WSL",
    "source_url": "https://windsurf.com/changelog#bug-fixes-and-improvements",
    "change_id": "windsurf/2026-05-16-bug-fixes-and-improvements/4"
  },
  "output": {
    "kind": "fix",
    "severity": "low",
    "subject": "Devin local agent path resolution restored on WSL",
    "action_text": "Upgrade Windsurf to the 2026-05-16 build if running the `Devin local agent` under WSL. Path resolution was failing and has been repaired; no config change required on the user side.",
    "deadline": null,
    "tags": ["windsurf", "wsl", "devin"]
  },
  "provenance": {
    "labeler": "opus-4.7-subagent-batch10",
    "labeled_at": "2026-05-24",
    "reviewer": null,
    "reviewed_at": null,
    "review_action": "pending"
  },
  "quality": {
    "faithfulness": "ok",
    "schema_valid": true,
    "human_grade": null
  }
}
