{
  "id": "syn-anthropic-sdk-typescript-0.95.1-1-sec",
  "schema_version": "1",
  "input": {
    "product": "anthropic-sdk-typescript",
    "version": "0.95.1",
    "released_at": "2026-05-11",
    "kind_hint": "changed",
    "change_text": "redact api-key headers in debug logs ([fad8fee](https://github.com/anthropics/anthropic-sdk-typescript/commit/fad8feeb51d1b9bafaf85cf8345bb28627728e00))",
    "source_url": "https://github.com/anthropics/anthropic-sdk-typescript/releases/tag/v0.95.1",
    "change_id": "anthropic-sdk-typescript/0.95.1/1"
  },
  "output": {
    "kind": "security",
    "severity": "high",
    "subject": "anthropic-sdk-typescript redacts x-api-key from debug logs",
    "action_text": "Upgrade `anthropic-sdk-typescript` to 0.95.1+ to redact `x-api-key` headers from debug log output. Pre-fix, enabling debug logging wrote API keys to logs in plaintext. Audit prior debug logs for leaked keys and rotate exposed credentials.",
    "deadline": null,
    "tags": ["credential-leak", "debug-logging", "api-key", "typescript"]
  },
  "provenance": {
    "labeler": "opus-4.7-this-session-a25",
    "labeled_at": "2026-05-24",
    "reviewer": null,
    "reviewed_at": null,
    "review_action": "pending"
  },
  "quality": {
    "faithfulness": "ok",
    "schema_valid": true,
    "human_grade": null
  }
}
