{
  "id": "syn-vscode-copilot-chat-v1_113-47",
  "schema_version": "1",
  "input": {
    "product": "vscode-copilot-chat",
    "version": "v1_113",
    "released_at": "2026-05-15",
    "kind_hint": "changed",
    "change_text": "Agent experience (#_agent-experience)",
    "source_url": "https://code.visualstudio.com/updates/v1_113",
    "change_id": "vscode-copilot-chat/v1_113/47"
  },
  "output": {
    "kind": "unknown",
    "severity": "low",
    "subject": "Agent experience — section heading only",
    "action_text": "Read the upstream v1_113 release notes at the source URL for the `Agent experience` section's actual content. The parsed `change_text` is the heading anchor only; no actionable detail is derivable from the entry alone.",
    "deadline": null,
    "tags": ["vscode", "release-notes-vague", "parser-artifact"]
  },
  "provenance": {
    "labeler": "opus-4.7-subagent-batch10",
    "labeled_at": "2026-05-24",
    "reviewer": null,
    "reviewed_at": null,
    "review_action": "pending"
  },
  "quality": {
    "faithfulness": "ok",
    "schema_valid": true,
    "human_grade": null
  }
}
