{
  "id": "syn-mcp-typescript-sdk--modelcontextprotocol-client-2.0.0-alpha.1-10",
  "schema_version": "1",
  "input": {
    "product": "mcp-typescript-sdk",
    "version": "@modelcontextprotocol/client@2.0.0-alpha.1",
    "released_at": "2026-04-01",
    "kind_hint": "changed",
    "change_text": "[#1824](https://github.com/modelcontextprotocol/typescript-sdk/pull/1824) [`fcde488`](https://github.com/modelcontextprotocol/typescript-sdk/commit/fcde4882276cb0a7d199e47f00120fe13f7f5d47) Thanks [@felixweinberger](https://github.com/felixweinberger)! - Drop `zod` from `peerDependencies` (kept as direct dependency)",
    "source_url": "https://github.com/modelcontextprotocol/typescript-sdk/releases/tag/%40modelcontextprotocol/client%402.0.0-alpha.1",
    "change_id": "mcp-typescript-sdk/@modelcontextprotocol/client@2.0.0-alpha.1/10"
  },
  "output": {
    "kind": "breaking",
    "severity": "medium",
    "subject": "zod removed from @modelcontextprotocol/client peerDependencies",
    "action_text": "Add `zod` to your own `dependencies` if you import it through `@modelcontextprotocol/client@2.0.0-alpha.1+`. The SDK keeps `zod` as a direct dependency so functionality is unchanged, but consumers that relied on the peer-dep prompt to install it must declare it explicitly.",
    "deadline": null,
    "tags": [
      "mcp",
      "typescript",
      "zod",
      "peer-dependency"
    ]
  },
  "provenance": {
    "labeler": "opus-4.7-subagent-batch10",
    "labeled_at": "2026-05-24",
    "reviewer": "human+qwen3-judge-a3c",
    "reviewed_at": "2026-05-25",
    "review_action": "approved"
  },
  "quality": {
    "faithfulness": "ok",
    "schema_valid": true,
    "human_grade": null
  }
}
