{
  "id": "syn-anthropic-sdk-ruby-1.34.0-1",
  "schema_version": "1",
  "input": {
    "product": "anthropic-sdk-ruby",
    "version": "1.34.0",
    "released_at": "2026-04-14",
    "kind_hint": "deprecated",
    "change_text": "**api:** mark Sonnet and Opus 4 as deprecated ([287e6c4](https://github.com/anthropics/anthropic-sdk-ruby/commit/287e6c471b24ef580260224675dddd08218dcd68))",
    "source_url": "https://github.com/anthropics/anthropic-sdk-ruby/releases/tag/v1.34.0",
    "change_id": "anthropic-sdk-ruby/1.34.0/1"
  },
  "output": {
    "kind": "deprecation",
    "severity": "high",
    "subject": "Sonnet 4 and Opus 4 marked deprecated in anthropic-sdk-ruby",
    "action_text": "Migrate Ruby SDK callers from `claude-sonnet-4-20250514` and `claude-opus-4-20250514` to `claude-sonnet-4-6` and `claude-opus-4-7`. Upstream retires both models on the Claude API 2026-06-15; calls to the retired IDs will fail after that date.",
    "deadline": "2026-06-15",
    "tags": ["model-retirement", "claude-sonnet-4", "claude-opus-4", "ruby-sdk"]
  },
  "provenance": {
    "labeler": "opus-4.7-subagent-batch05",
    "labeled_at": "2026-05-24",
    "reviewer": null,
    "reviewed_at": null,
    "review_action": "pending"
  },
  "quality": {
    "faithfulness": "ok",
    "schema_valid": true,
    "human_grade": null
  }
}
